{
  "site": "shop",
  "release_id": "01J9Z8Y7X6W5V4T3S2R1Q0P9N1",
  "shared_paths": [{ "path": "storage", "type": "dir" }, { "path": ".env", "type": "file" }, { "path": "public/uploads", "type": "dir" }],
  "env_file": { "content": "APP_ENV=production\nAPP_KEY=base64:secret\n", "path": ".env" },
  "owner": { "user": "shop" },
  "writable_dirs": ["bootstrap/cache"]
}
